{
  "job_id": "20261007-1-1",
  "items": [
    {
      "channel": "stdout",
      "text": "ready\n"
    },
    {
      "channel": "stderr",
      "text": "notice\n"
    }
  ],
  "next_continuation": "v1.eyJiaW5kaW5nIjp7fSwib3BlcmF0aW9uIjoib3V0cHV0Iiwib3duZXIiOiJqb2JzIiwicG9zaXRpb24iOnsiY2hhcl9vZmZzZXQiOjAsIml0ZW1fZGlnZXN0IjoiIiwiaXRlbV9pbmRleCI6Nn0sInJlZiI6IjIwMjYxMDA3LTEtMTpzdGRvdXQiLCJ2ZXJzaW9uIjoxfQ.c0c131f5fa372d19a73548fb99ceee009e341245245d6499d9a767a104de4d88~v1.eyJiaW5kaW5nIjp7fSwib3BlcmF0aW9uIjoib3V0cHV0Iiwib3duZXIiOiJqb2JzIiwicG9zaXRpb24iOnsiY2hhcl9vZmZzZXQiOjAsIml0ZW1fZGlnZXN0IjoiIiwiaXRlbV9pbmRleCI6N30sInJlZiI6IjIwMjYxMDA3LTEtMTpzdGRlcnIiLCJ2ZXJzaW9uIjoxfQ.dcd13170740072e4f47af0b596a27937cea94271bd11f463888798c1fbbb5e5f",
  "truncated": false,
  "result_locators": [
    {
      "ref": "workspace:jobs/20261007-1-1/logs/stdout.log",
      "day": "2026-10-07"
    },
    {
      "ref": "workspace:jobs/20261007-1-1/logs/stderr.log",
      "day": "2026-10-07"
    }
  ]
}
