{
  "job_id": "job_1",
  "items": [
    {
      "channel": "stdout",
      "text": "ready\n"
    },
    {
      "channel": "stderr",
      "text": "notice\n"
    }
  ],
  "next_continuation": "continuation_2",
  "truncated": false,
  "result_locators": [
    {
      "ref": "workspace:jobs/job_1",
      "day": "2026-09-29"
    },
    {
      "ref": "workspace:jobs/job_1/logs/stdout.log",
      "day": "2026-09-29"
    },
    {
      "ref": "workspace:jobs/job_1/logs/stderr.log",
      "day": "2026-09-29"
    }
  ]
}
